,number,value,datetime_start,datetime_complete,duration,params_activation_fn,params_batch_size,params_clip_range,params_ent_coef,params_gae_lambda,params_gamma,params_learning_rate,params_max_grad_norm,params_n_epochs,params_n_steps,params_net_arch,params_ortho_init,params_vf_coef,state
0,0,-21.0,2025-02-04 23:35:30.125293,2025-02-05 00:47:15.094713,0 days 01:11:44.969420,relu,128,0.1,1.720418909559032e-06,0.99,0.98,0.16802155235592658,0.6,1,8,small,False,0.299890459893346,COMPLETE
1,1,-21.0,2025-02-04 23:35:30.126455,2025-02-05 05:28:22.669197,0 days 05:52:52.542742,relu,64,0.35,0.006385804490618837,0.95,0.85,0.16240528402912002,0.6,10,32,medium,True,0.9824442028871282,COMPLETE
2,2,-20.2,2025-02-04 23:35:30.127226,2025-02-05 06:45:39.314833,0 days 07:10:09.187607,leaky_relu,16,0.2,1.1075723499320258e-08,0.95,0.98,3.552347350681894e-05,1.0,10,16,identity,True,0.2275134235026484,COMPLETE
3,3,-21.0,2025-02-04 23:35:30.127933,2025-02-05 08:23:07.040406,0 days 08:47:36.912473,tanh,4,0.15,0.001036642555515722,0.8,0.98,0.0029920965235278665,1.0,5,32,large,False,0.4565278502834527,COMPLETE
4,4,-19.8,2025-02-04 23:35:30.128230,2025-02-05 11:47:44.757118,0 days 12:12:14.628888,relu,4,0.3,1.3790917273521505e-07,0.85,0.98,0.0004639451680195324,0.3,7,8,large,True,0.8440513203063611,COMPLETE
5,5,-21.0,2025-02-04 23:35:30.158023,2025-02-05 04:25:00.351630,0 days 04:49:30.193607,sigmoid,128,0.15,3.8067981516606364e-06,0.95,0.995,0.9753571425814872,0.3,7,8,identity,False,0.5276074687247441,COMPLETE
6,6,-21.0,2025-02-04 23:35:30.188133,2025-02-05 03:39:16.316891,0 days 04:03:46.128758,leaky_relu,128,0.3,0.0004094599753553623,0.98,0.95,0.017230919116799647,1.0,7,32,small,False,0.7878823911223958,COMPLETE
7,7,-21.0,2025-02-04 23:35:30.188942,2025-02-05 00:32:01.239383,0 days 00:56:31.050441,relu,32,0.1,0.0004710581884905539,0.95,0.995,0.8313582506577428,0.7,1,256,small,False,0.646170229135858,COMPLETE
8,8,-21.0,2025-02-04 23:35:30.278281,2025-02-05 06:26:59.327889,0 days 06:51:29.049608,tanh,16,0.15,0.0009206338457545193,0.99,0.98,1.553730813309111e-05,0.3,7,8,large,True,0.6114832311462225,COMPLETE
9,9,-21.0,2025-02-04 23:35:30.278684,2025-02-05 08:04:08.223302,0 days 08:28:37.944618,leaky_relu,4,0.1,4.857137013931872e-08,0.85,0.999,0.004905007902809472,0.6,7,32,small,False,0.5141207363798128,COMPLETE
10,10,-2.2,2025-02-05 00:32:01.241478,2025-02-05 02:37:49.598555,0 days 02:05:48.357077,tanh,32,0.3,0.000692808456996194,0.95,0.98,0.00018143432320362978,0.3,3,1024,medium_pi,False,0.5181353678038471,COMPLETE
11,11,-21.0,2025-02-05 00:47:15.095614,2025-02-05 01:32:21.718620,0 days 00:45:06.623006,tanh,512,0.15,0.006546148216972277,0.95,0.85,0.009018452872846236,0.8,1,512,small,True,0.3036154417798436,COMPLETE
12,12,-20.2,2025-02-05 01:32:21.719639,2025-02-05 06:58:05.440095,0 days 05:25:43.720456,relu,512,0.4,5.614937666018001e-05,0.98,0.99,5.6211805576810534e-05,0.8,15,1024,medium_pi,False,0.5531301949478554,COMPLETE
13,13,-20.2,2025-02-05 02:37:49.599551,2025-02-05 04:42:09.148682,0 days 02:04:19.549131,tanh,512,0.4,1.4629654244642256e-08,0.85,0.95,1.8283608798318633e-05,0.3,3,32,medium,False,0.538268117509395,COMPLETE
14,14,-18.8,2025-02-05 03:39:16.317833,2025-02-05 05:47:59.928406,0 days 02:08:43.610573,tanh,32,0.3,0.05,0.95,0.98,1e-05,0.3,3,1024,medium_pi,False,0.3289880994948369,COMPLETE
15,15,-20.6,2025-02-05 04:25:00.353179,2025-02-05 06:39:53.796608,0 days 02:14:53.443429,tanh,32,0.3,0.05,0.95,0.98,1e-05,0.3,3,1024,medium_pi,False,0.6023447126690175,COMPLETE
16,16,-20.0,2025-02-05 04:42:09.150406,2025-02-05 06:57:15.981590,0 days 02:15:06.831184,tanh,32,0.3,0.034780162167972875,0.95,0.98,1e-05,0.3,3,1024,medium_pi,False,0.508027619217153,COMPLETE
17,17,-20.8,2025-02-05 05:28:22.670880,2025-02-05 07:46:59.018503,0 days 02:18:36.347623,tanh,32,0.3,0.01984036702504446,0.95,0.98,1.0213621494505714e-05,0.3,3,1024,medium_pi,False,0.4714974885683456,COMPLETE
18,18,-20.0,2025-02-05 05:47:59.929625,2025-02-05 08:09:27.666189,0 days 02:21:27.736564,tanh,32,0.3,0.00017646298711691192,0.95,0.98,0.00040801056249702535,0.3,3,1024,medium_pi,False,0.5791736136037573,COMPLETE
19,19,-20.8,2025-02-05 06:26:59.329693,2025-02-05 09:38:39.694832,0 days 03:11:40.365139,tanh,32,0.3,0.00019468362969675643,0.95,0.98,0.0003929583777632,0.3,3,1024,medium_pi,False,0.5738372205556238,COMPLETE
20,20,-20.2,2025-02-05 06:39:53.798662,2025-02-05 09:53:23.221582,0 days 03:13:29.422920,tanh,32,0.3,0.00023032434654186276,0.95,0.98,0.0003564228190988232,0.3,3,1024,medium_pi,False,0.38253297390860086,COMPLETE
21,21,-20.2,2025-02-05 06:45:39.317329,2025-02-05 10:00:37.281354,0 days 03:14:57.964025,tanh,32,0.3,0.0002466788208193191,0.95,0.98,0.0003422916149685116,0.3,3,1024,medium_pi,False,0.3928626865836582,COMPLETE
22,22,-20.6,2025-02-05 06:57:15.983125,2025-02-05 10:12:36.876262,0 days 03:15:20.893137,tanh,32,0.3,0.00031698330711414646,0.95,0.98,0.0003566816597759437,0.3,3,1024,medium_pi,False,0.33471610604340996,COMPLETE
23,23,-20.8,2025-02-05 06:58:05.441219,2025-02-05 10:14:23.654067,0 days 03:16:18.212848,tanh,32,0.3,0.0003292178320576393,0.95,0.98,0.0003448779290689863,0.3,3,1024,medium_pi,False,0.3464149146991984,COMPLETE
24,24,-20.0,2025-02-05 07:46:59.020162,2025-02-05 11:09:04.753370,0 days 03:22:05.733208,tanh,32,0.3,0.0010457888479948295,0.95,0.98,0.0003653247704181145,0.3,3,1024,medium_pi,False,0.43407453163585363,COMPLETE
25,25,-19.6,2025-02-05 08:04:08.224968,2025-02-05 11:27:27.730140,0 days 03:23:19.505172,tanh,32,0.3,0.0010107102756245494,0.95,0.98,0.0003542793423148866,0.3,3,1024,medium_pi,False,0.4378276467065598,COMPLETE
26,26,-2.6,2025-02-05 08:09:27.668126,2025-02-05 11:37:36.163024,0 days 03:28:08.494898,tanh,32,0.3,0.0011289231935197696,0.95,0.98,0.00016333621593195698,0.3,3,1024,medium_pi,False,0.4654003075149511,COMPLETE
27,27,2.2,2025-02-05 08:23:07.042218,2025-02-05 11:51:57.312185,0 days 03:28:50.269967,tanh,32,0.3,0.0011128846255726973,0.95,0.98,0.0001606355595983809,0.3,3,1024,medium_pi,False,0.46938948965821337,COMPLETE
28,28,-8.2,2025-02-05 09:38:39.699245,2025-02-05 13:07:47.462566,0 days 03:29:07.763321,tanh,32,0.3,0.0012000872682914904,0.95,0.98,0.00014281475161500407,0.3,3,1024,medium_pi,False,0.46932954974666574,COMPLETE
29,29,-14.2,2025-02-05 09:53:23.223333,2025-02-05 13:26:45.233699,0 days 03:33:22.010366,tanh,32,0.3,0.0011877914864841274,0.95,0.98,0.000137950884939882,0.3,3,1024,medium_pi,False,0.6124688589629168,COMPLETE
30,30,-5.6,2025-02-05 10:00:37.282734,2025-02-05 13:31:57.021317,0 days 03:31:19.738583,tanh,32,0.3,0.0011831119475464514,0.95,0.98,0.00013651721843178303,0.3,3,1024,medium_pi,False,0.610122611728536,COMPLETE
31,31,-3.4,2025-02-05 10:12:36.878777,2025-02-05 13:43:48.909342,0 days 03:31:12.030565,tanh,32,0.3,0.0016392356414196795,0.95,0.98,0.00011501019997066054,0.3,3,1024,medium_pi,False,0.6167301314583012,COMPLETE
32,32,16.4,2025-02-05 10:14:23.656403,2025-02-05 13:45:04.392234,0 days 03:30:40.735831,tanh,32,0.3,0.0014596524220627765,0.95,0.98,0.00011434790208101046,0.3,3,1024,medium_pi,False,0.6201439946965244,COMPLETE
33,33,-15.8,2025-02-05 11:09:04.755171,2025-02-05 14:40:45.748526,0 days 03:31:40.993355,tanh,32,0.3,0.002073747757353271,0.95,0.98,0.00011469449982549312,0.3,3,1024,medium_pi,False,0.6206691508124123,COMPLETE
34,34,-15.8,2025-02-05 11:27:27.732281,2025-02-05 15:43:55.133033,0 days 04:16:27.400752,tanh,32,0.3,0.002157732035892731,0.95,0.98,0.00011506917078913826,0.3,3,1024,medium_pi,False,0.621412123244142,COMPLETE
35,35,-12.0,2025-02-05 11:37:36.164529,2025-02-05 16:45:20.739480,0 days 05:07:44.574951,tanh,32,0.3,0.0013857630186418913,0.95,0.98,0.0001178457622020188,0.3,3,1024,medium_pi,False,0.6817209916266697,COMPLETE
36,36,-5.6,2025-02-05 11:47:44.758622,2025-02-05 16:57:33.942626,0 days 05:09:49.184004,tanh,32,0.3,0.0013783744432809295,0.95,0.98,0.00011861899005417873,0.3,3,1024,medium_pi,False,0.6734593352877121,COMPLETE
37,37,-18.4,2025-02-05 11:51:57.314077,2025-02-05 16:58:02.399461,0 days 05:06:05.085384,tanh,32,0.3,0.0029557313391121555,0.95,0.98,9.654239195823788e-05,0.3,3,1024,medium_pi,False,0.6191206893706739,COMPLETE
38,38,-15.4,2025-02-05 13:07:47.463952,2025-02-05 17:27:34.189543,0 days 04:19:46.725591,tanh,32,0.3,0.005433409341722595,0.95,0.98,0.00010202351184959742,0.3,3,1024,medium_pi,False,0.9535592571011781,COMPLETE
39,39,-6.6,2025-02-05 13:26:45.235748,2025-02-05 17:45:42.148148,0 days 04:18:56.912400,tanh,32,0.3,4.706133657338981e-07,0.95,0.98,8.315237170703666e-05,0.3,3,1024,medium_pi,False,0.44016835186916237,COMPLETE
40,40,-17.4,2025-02-05 13:31:57.024557,2025-02-05 17:50:18.521688,0 days 04:18:21.497131,tanh,32,0.3,0.05,0.95,0.98,8.028678829964188e-05,0.3,3,1024,medium_pi,False,0.36882698465365726,COMPLETE
41,41,-10.6,2025-02-05 13:43:48.911418,2025-02-05 18:00:52.402842,0 days 04:17:03.491424,tanh,32,0.3,0.05,0.95,0.98,7.906404639490391e-05,0.3,3,1024,medium_pi,False,0.24546634783339258,COMPLETE
42,42,-11.2,2025-02-05 13:45:04.397275,2025-02-05 18:02:05.717699,0 days 04:17:01.320424,elu,32,0.3,0.05,0.95,0.98,7.389413912451809e-05,0.3,3,1024,medium_pi,False,0.9999999999999999,COMPLETE
43,43,-20.2,2025-02-05 14:40:45.750401,2025-02-05 18:35:45.513618,0 days 03:54:59.763217,elu,32,0.3,0.05,0.95,0.8,7.703097906438547e-05,0.3,3,1024,medium_pi,False,1.0,COMPLETE
44,44,-18.8,2025-02-05 15:43:55.134410,2025-02-05 18:47:36.785347,0 days 03:03:41.650937,elu,32,0.3,2.110295531407898e-08,0.95,0.98,5.6154475531600965e-05,0.5,3,1024,medium_pi,False,1.0,COMPLETE
45,45,-21.0,2025-02-05 16:45:20.741150,2025-02-05 19:08:31.944559,0 days 02:23:11.203409,elu,32,0.3,0.05,0.95,0.9999,7.571655888483346e-05,0.5,3,4,medium_pi,False,0.9999999999999999,COMPLETE
46,46,-15.4,2025-02-05 16:57:33.944211,2025-02-05 18:56:01.384574,0 days 01:58:27.440363,elu,32,0.3,0.05,0.95,0.8,7.56428953308466e-05,0.5,3,1024,medium_vf,False,1.0,COMPLETE
47,47,-20.4,2025-02-05 16:58:02.401189,2025-02-05 18:56:13.227008,0 days 01:58:10.825819,elu,32,0.3,1e-08,0.95,0.8,4.991555964943333e-05,0.5,3,1024,medium_pi,False,1.0,COMPLETE
48,48,-20.2,2025-02-05 17:27:34.191182,2025-02-05 19:03:30.303196,0 days 01:35:56.112014,elu,32,0.3,1e-08,0.95,0.98,3.539899915257432e-05,0.3,3,1024,medium_pi,False,0.1,COMPLETE
49,49,-20.8,2025-02-05 17:45:42.149708,2025-02-05 19:19:32.554121,0 days 01:33:50.404413,elu,32,0.3,1e-08,0.95,0.8,5.7701465468524356e-05,0.5,3,4,medium_pi,False,0.1,COMPLETE
